country,genre,topic,author,name,description,year
zahraniční,faktografická literatura,život,Matthew Walker,Proč spíme,"Kolik hodin jste dnes v noci spali? Pokud méně než osm, pak asi stejně jako většina lidstva trpíte spánkovou deprivací. A přicházíte o to nejlepší. Lidé, kteří si dopřávají dostatek spánku, jsou zdravější, chytřejší, štíhlejší, atraktivnější a šťastnější. Příčinu své úna vy a zdravotních potíží hledejte v nedostatku kvalitního spánku a pak teprve jinde.\n\nKniha předního světového neurovědce Matthewa Walkera odkrývá nejnovější poznatky z výzkumu spánku a ukazuje, že evoluce nás touto bezbrannou a neproduktivní fází denního rytmu nevybavila náhodou. Díky převratnému rozvoji a dostupnosti zobrazovacích metod dokáže věda poprvé v historii zodpovědět, proč vůbec spíme, jak spánek prospívá našemu tělu a mozku a proč má neřešená dlouhodobá spánková deprivace tak ničivé následky pro naše zdraví.\n\nWalker fascinujícím způsobem objasňuje vliv spánku na logické rozhodování, učení a paměť, na seřizování našich emocí a imunitní systém, ale i metabolismus a chuť k jídlu. A přesvědčivě dokládá, že chronický nedostatek kvalitního spánku nás může nejen mnoha různými způsoby zabít, ale také ovlivnit rozhodování a chování celé společnosti.\n\nSeznamte se i vy s posledními vědeckými objevy, díky nimž pochopíte, jaký elixír zdraví, štěstí i moudrosti ve svých životech (a postelích) máme. V knize najdete i rady, jak odstranit různé špatné návyky a další překážky, které brání kvalitnímu spánku vás i vašich blízkých. ",2018
zahraniční,faktografická literatura,historie,Barbara Cartland,Sissi - Soukromý život Alžběty; císařovny rakouské,"Se sympatiemi a pochopením pojatá biografie manželky Františka Josefa I., jejíž život byl nerozlučně spjatý s historií a osudem dynastie.\n\nAutorka zachycuje osud ženy, poznamenaný rodinnou výchovou na dvoře bavorského vévody, aristokratickou tradicí, ale zejména diktaturou tchyně, arcivévodkyně Žofie a manželovou oddaností k matce, dvorskému ceremoniálu a službě říši.",1992
čeští,dobrodružná literatura,dobrodružství,František Novotný,Robinson Crusoe,"Nové převyprávění nesmrtelného příběhu o světoznámém trosečníkovi klade důraz na vlastnosti, bez nichž se člověk, jenž chce přežít v nebezpečných podmínkách, nedokáže obejít. A to ani v dnešní době. Odvaha, vytrvalost a zejména zdravý rozum hlavnímu hrdinovi Robinovi rozhodně nechybí. Jinak by nedokázal přežít všechny strasti, které ho čekají?",2005
čeští,dobrodružná literatura,dobrodružství,Jaroslav Foglar,Záhada hlavolamu,"Hlavní roli v knize hraje chlapecký klub Rychlé šípy, již dříve čtenářům známý z komiksů. Foglar v knize poprvé představuje záhadnou čtvrť Stínadla a organizaci Vontů, hlavolam zvaný „ježek v kleci“ a ztraceného vynálezce Jana Tleskače, motivy později využité v dalších knihách, které se následně staly téměř kultovní součástí české kultury.",1941
čeští,dobrodružná literatura,dobrodružství,Jaroslav Foglar,Stínadla se bouří,"Po několika měsících klidu jsou Stínadla opět v pohybu. Nečekaná zpráva o znovunalezeném ježkovi v kleci spustí smršť nových událostí, vontské hnutí ožije a schyluje se k volbě Velkého Vonta. Pro všechny z okolních čtvrtí tak začíná být ve Stínadlech opět nebezpečno. To nemůžou Rychlé šípy nechat bez povšimnutí a samy se pouštějí do pátrání po hlavolamu. Chtěly by totiž získat plánek létajícího kola, který je v něm ukrytý.",1947
čeští,dobrodružná literatura,dobrodružství,Jaroslav Foglar,Hoši od Bobří řeky,"říběh o skautských výpravách, plnění bobříků, i o ryzím přátelství. Vedoucí Rikitan dá dohromady partu dvanácti chlapců a utvoří oddané bratrstvo. Každý z nich je jiný, ale všichni se navzájem skvěle doplňují. Rikitan pro chlapce vymýšlí zábavné hry, aby je vedl k čestnosti, fyzické síle i moudrosti. Společně si zamilovávají přírodu a podle zálesáka Roye loví bobříky. Stávají se tak věrnými kamarády, kteří spolu zažívají nezapomenutelná dobrodružství.",1937
čeští,dobrodružná literatura,dobrodružství,Jaroslav Foglar,Tajemství Velkého Vonta,"Po neklidné éře bezvládí ve Stínadlech zvítězilo vontské hnutí Žlutý květ. Velkým Vontem se stal Vláďa Dratuš, ale v poslední době s ním cosi není v pořádku – chová se čím dál nervózněji, a navíc se ulicemi šíří zvěsti, že přišel o ježka v kleci. Kdo je tajemný Cizinec, který Vláďu v poslední době navštívil, a co mu chtěl? Rychlé šípy musejí záhadě přijít na kloub dřív, než Stínadla opět zachvátí vlna násilí a nejistoty.",1986
čeští,dobrodružná literatura,historie,Eduard Štorch,Lovci mamutů,"Tento příběh vypráví o kmeni pravěkých lidí „Lovců mamutů“. Udál se asi před dvaceti až třiceti tisíci lety. Tehdy žila na Bílé skále tlupa pravěkých lidí. Ovládali jednoduchou řeč a doplňovali ji posunky a mimikou v obličeji.\nVěděli, že je oheň nejen zahřeje, ale dokáže upé ct maso a chránit před divokou zvěří. Oheň hořel před vchodem do jeskyně, aby dovnitř nemohly šelmy. Tehdy ho ještě neuměli rozdělat, tak spoléhali na přírodu a oheň donášeli.\nPříběh nám bude vyprávět o tom, jak lovili zvěř a jak z ní vše dokázali zužitkovat. Vnitřnosti zvěře jedli syrové, protože byly ještě teplé. Stažené kůže hned zpracovávaly ženy a děti. Lovili například zubry, lišky, ryby, ale také vlky a mamuty. Věřte, chytit takového mamuta je věc těžká, na kterou se museli dlouho připravovat. Museli nejdřív vykopat obrovskou jámu, do které toho mamuta museli vehnat.\nUčili se také vyrábět si nástroje, jako je například kámen opracovaný do tvaru slzy (pazourek). Díky pazourku, který poté použili na rozbíjení kamenů, dokázali vykřesat oheň. Ale to chtělo zručnost a trpělivost.\nPozději se jim podařilo dokonce rozdělat oheň za pomoci kousku dřeva. Oheň byl totiž v pravěku největší vynález pravěkých lidí a měl pro ně opravdu obrovský význam.\nDovídáme se tu také o cizích tlupách, například jak mezi sebou bojovali o území, o kořist atd. Při lovu nebo boji o území zahynula velká spousta pravěkých lidí. Byl to pro ně boj na život a na smrt.",1918
čeští,dobrodružná literatura,dobrodružství,Martin Vopěnka,Spící město,"Co kdybyste jednoho rána zjistili, že vaši rodiče nejsou k probuzení? Přesně tak začíná napínavý příběh Spícího města. Čtyři vyděšení sourozenci Kryštof, Samuel, Kristýna a Ema postupně zjišťují, že nespí jen jejich rodiče, ale úplně všichni lidé, kteří kdy měli děti. Všude zavládne chaos, na ulicích přestane být bezpečno a děti nevědí, co dělat. Musí se ale o sebe postarat. Tím spíš, když toho nejmladšího, Samuela, někdo odveze neznámo kam. Nastává dobrodružná cesta za záchranou malého brášky. Děti během ní poznávají, jak je důležité držet při sobě, pomáhat si a nedat se. Shledají se všichni sourozenci? A probudí se jejich rodiče z podivného spánku? ",2011
čeští,dobrodružná literatura,život,Eduard Bass,Cirkus Humberto,"Bass zde na pozadí cirkusu sleduje tři generace cirkusáků. Ústřední postavou je Vašek Karas, syn šumavského zedníka, který odejde k cirkusu, nakonec se ožení s dcerou ředitele a sám se později stane ředitelem cirkusu, předtím však vystřídá mnoho různých profesí u cirkusu.",1941
čeští,dobrodružná literatura,dobrodružství,Vojtěch Matocha,Prašina,"Prašina je tajuplné místo, temný ostrov uprostřed zářící Prahy. Nikdo neví proč, ale na Prašině nefunguje elektřina. Lampy tu nesvítí, tramvaje nejezdí, rádio nehraje, mobil je bez signálu. A v téhle strašidelné čtvrti pátrá Jirka se svými kamarády Tondou a En po dávném tajemství, kte ré by mohlo změnit svět. Jejich dobrodružství je o to nebezpečnější, že při něm musejí čelit partě všeho schopných dospělých chlapů, kteří mají stejný cíl. Foglarovsky laděný a mimořádně napínavý příběh doplňují ilustrace, které čtenáře vezmou přímo do nitra Prašiny.",2018
zahraniční,román,život,John Green,Hvězdy nám nepřály,"Hazel diagnostikovali ve třinácti letech rakovinu. Teď je jí šestnáct a rakovina je v posledním stadiu. Nikdo neví, jak dlouho bude žít, ale vědí, že smrt je nevyhnutelná. Hazel tráví dny sledováním nekonečného pořadu Amerika hledá topmodelku a čtením oblíbené knížky od holandského spisovatele Petera Van Houtena. Začne z donucení rodičů chodit do podpůrné skupiny, kde se schází lidé s rakovinou. Tam se seznámí s okouzlujícím Augustem Watersem, jenž vyšel z boje s rakovinou s amputovanou nohou. Začnou spolu trávit čas a Gus probudí v Hazel chuť znovu žít. Hazel si ale uvědomuje, že může každým dnem zemřít, proto se do Guse bojí zamilovat - nechce mu svým odchodem zlomit srdce. Gus ji ale přesvědčí, že by si krásu zamilovanosti měli užít právě proto, jak málo času jim oběma zbývá.",2012
zahraniční,román,dospívání,John Green,Hledání Aljašky,"Šestnáctiletý Miles, posedlý sbíráním posledních slov významných osobností a touhou hledat „velké Možná“, je spíše outsiderem mezi svými vrstevníky. Jeho život získá zcela novou podobu, když přejde na internátní školu Culver Creek. Zde se rychle spřátelí se svérázným spolubydlícím a okouzlující, naprosto nepředvídatelnou Aljaškou Youngovou. Okamžitě je vtažen do světa, kde se porušují školní pravidla, pořádají různé večírky i provokace. Miles ožívá v dennodenním kontaktu s novými kamarády a stále víc miluje fascinující Aljašku. A tak vývoj směřuje k okamžiku, kdy se všechno nečekaně navždy změní... Živý, naléhavý a nekonečně dojemný příběh. ",2005
čeští,cestopis,cestování po Česku,Ladislav Zibura,Prázdniny v Česku,"Výlet za vším, co jste o Česku nevěděli. Vydejte se s Ladislavem Ziburou na dvouměsíční výlet po českých luzích a hájích a připomeňte si, v jak rozmanité a krásné zemi žijeme. Můžete se těšit na vyprávění plné zajímavostí, pozoruhodných příběhů z naší historie a setkání se svéráznými lidmi. Navštívíte všech čtrnáct českých krajů, načerpáte tipy na vlastní výpravy a jako obvykle se také od srdce zasmějete. Tak přisedněte do roztomilého bílého autíčka a nezapomeňte se připoutat! Váš řidič je začátečník.",2021
čeští,cestopis,cestování po světě,Ladislav Zibura,40 dní pěšky do Jeruzaléma,"Autor v létě 2014 hodil batoh na záda a vydal se na pouť do Jeruzaléma. Bez mapy a orientačního smyslu pěšky ušel 1 400 kilometrů napříč rozpálenou krajinou Turecka a Izraele, stanul pod Zdí nářků a prožil největší dobrodružství svého života. Těšit se můžete na vyprávění kavárenského povaleče, který vám svým laskavě nekorektním humorem dokáže, že poutník rozhodně nemusí být katolík, asketa ani nudný člověk.",2015
čeští,cestopis,cestování po světě,Ladislav Zibura,Už nikdy pěšky po Arménii a Gruzii,"Ladislav Zibura se vydává do těch nejzapadlejších vesnic, aby mohl poslouchat příběhy místních a načerpat něco z jejich
moudrosti. Alkohol teče proudem a mladý dobrodruh důvěrně poznává kulturu plnou pohostinnosti, rozhodných slov a sovětské nostalgie. Své zážitky z kavkazského putování líčí s tradičním humorem a sebeironií, pro které ho čtenáři nenávidí a milují.",2017
čeští,cestopis,cestování po světě,Martin Úbl,Neuvěřitelné příhody z hor,"Co se stane, když expedici vede gumové kuře? Jaké jsou typické sny na treku? Jak to dopadá, když chlapec vezme svoji přítelkyni na 14 dní mimo civilizaci? Ač se může na první pohled zdát, že se úsměvné a někdy až k smíchu přivádějící příběhy z této knihy odehrávají v čistě horsk ém prostředí, není tomu tak. Během čtení čtenář zjistí, že jsou to příběhy napsané životem a o životě každého z nás. A jako i v životě, tak i na horách zdoláváte vrcholy i pády, ale s partou kamarádů jde všechno líp.",2017
čeští,cestopis,cestování po světě,Martin Úbl,Lehce neuvěřitelné příhody z hor,"Nová dávka neuvěřitelných příhod z hor, které mohou na horách potkat i vás. Jak přežít týdny v divočině bez jakékoliv pomoci? Proč netrhat medvědům borůvky? Jak vylézt na šestitisícovku, když se vám zrovna nechce? Hory! Bažiny! Brody! Jezera! Žádná cesta! Déšť a dinosauři! Kniha o tom, jak rozdýchat hory, sebe, své kamarády a navíc se přitom výborně bavit.
Jak přežít týdny v divočině bez jakékoliv pomoci? Proč netrhat medvědům borůvky? Jak vylézt na šestitisícovku, když se vám zrovna nechce? Čtěte, a dozvíte se.",2020
čeští,cestopis,cestování po Česku,Martin Úbl,Stezka Českem: Může jít každý,"První oficiální přechod po hranicích republiky. Kniha je kombinací průvodce, cestopisů, faktografických informací, turistických tipů ohledně trasy a oficiálního přechodu po hranicích republiky, která tvoří tisícikilometrovou trasu po jižní hranici a tisícikilometrovou po hranici severní.Kniha obsahuje jednak informativní kapitoly, ve kterých jsou popsány jednotlivé etapy, rady, jak se připravit na cestu, na co si dát pozor nebo tipy na nejkrásnější místa, ale také motivační kapitoly psány lidmi, kteří se rozhodli na Stezku vypravit. Samostatná kapitola je věnována Trail Angels, lidem, kteří ve svém volném čase dobrovolně pomáhají poutníkům na Stezce. Dočtete se ale také, na jakých principech a zásadách je Stezka založena, o Klubu českých turistů nebo třeba o udržitelném turismu.",2022
čeští,cestopis,cestování po světě,Tomáš Vejmola,Tomík na cestách,"Dopravní prostředek si vybral vskutku netradiční – tuk-tuk starý 35 let, který si pořídil v Thajsku. Odtud vyrazil přes Myanmar, Indii, Nepál, Írán, Turecko a další země, dokud po 13 000 kilometrech nedorazil do roka a do dne do České republiky. O výjimečné zážitky a neuvěřitelné situace neměl nezkušený Tomík nouzi: nabídky k sňatku, útěk před slonem, příšerní Indové, ale i nádherný Írán. To vše vám Tomík povypráví s humorem a nadsázkou.",2019
čeští,cestopis,cestování po Česku,Petr Nazarov,Pěšky kolem Česka,"40 dní, 1036 kilometrů. Pohodové vyprávění o putování českou krajinou a cestě do vlastní duše.\nAutor se vydává z nejvýchodnějšího bodu naší vlasti u Mostů u Jablunkova do bodu nejzápadnějšího u Aše. Překonává téměř 20 tisícimetrových vrcholů a musí se vypořádat s rozmary poč así i s řadou překážek. Zároveň potkává skvělé lidi, kteří mu nejednou nabídnou pomoc. Cesta mu přináší hluboké poznání, radost, důvěru v sebe sama a pocit svobody. Druhou polovinu trasy s ním absolvuje veselá čtyřnohá parťačka, border kolie Bublina. Kniha je inspirací pro každého, kdo touží po dobrodružství a sebepoznání.",2024
čeští,cestopis,cestování po světě,Petra Braunová,3333 km k Jakubovi,"Před prázdninami Mirek dostane od táty nečekanou a nevšední nabídku - dobrodružnou výpravu přes několik států, končící ve Španělsku. Je to cesta svatého Jakuba s cílem v Santiagu de Compostela. Musí se ovšem ujet 3333 km - na kole! Mirek výzvu přijme. Náročné a nepohodlné putování se nakonec pro bohémského otce i pubertálního syna stane zásadním zlomem v životě.",2014
čeští,cestopis,cestování po světě,Lucie Kutrová,151 dní po evropských stezkách,"Cestopis po evropských trailech, ale také putování životem holky, které hory, láska a bucket list změnily život. Nečekejte jen tu krásnou stránku, Lucie je ochotná se podělit i o ten opravdový život, někdy krutý a jindy nespravedlivý. Inspirujte se a vydejte se na delší přechod, než je ten od gauče k lednici, nebo od domu do práce. Zkuste si prožít tu volnost, kdy jste to jen vy, těžký batoh, skvělá nálada a hory. Ale pozor! Lůca varuje, že když vyjdete jednou, nebude to naposledy.",2021
čeští,cestopis,cestování po světě,Lucie Kutrová,151 dní Pacifickou hřebenovkou,"Lucie je holka, která se rozhodla projít Pacific Crest Trail, dle spousty lidí nejnáročnější dálkovou pěší trasu na světě, vedoucí z Kalifornie přes Oregon a Washington až ke kanadským hranicím (4 300 km). A povedlo se jí to. A přežila to. A že to párkrát bylo o vlásek.A ve své knize nepíše jen o tom, jaké to bylo, jít bez přípravy divočinou, ale taky o tom, jak taková věc člověka změní. A že když se pro něco rozhodnete a zatnete zuby, dokážete všechno. ",2019
čeští,cestopis,cestování po Česku,Lucie Kutrová,151 příběhů na Stezce Českem,"Pojďte si projít celou naši krásnou republiku a užít si přes 2000 km po českých kopcích a malebných vesničkách. Lucie je postrach ulice a na jejích cestách nikdy nechybí krizové situace, jež však většinou zvládne vyřešit s humorem, který jí není cizí. Uvidíte, kolik láskyplných lidí na cestě Lucie potká a s kým vším se seznámí.Na cestu s Lucií vyráží její největší parťák – sibiřský husky Marvel. Ale nebude jediný, kdo se k ní připojí. Nechá se zase ukecat brácha, který nesnáší šlapání do kopců? Přijedou kamarádky s dětmi? Připojí se 12letá holčička, která všem vytře zrak? Bude se partnerovi Lůcy stýskat více po Marvelovi, nebo po ní? Přijede i Marvelův tatínek? Kamarád, co miluje lezení a nesnáší chození? Kámoška s dalším huskym? Náhodní kolemjdoucí z přednášky? Guru lásky?",2023
čeští,cestopis,cestování po světě,Monika Benešová,Moje Pacifická hřebenovka,"Na Pacifickou hřebenovku se ročně vydá několik tisíc lidí, ale dokončí ji jen desetina z nich. Monika patří mezi ně. A to byla ještě před nedávnem bledou pacientkou s vážnými zdravotními a psychickými problémy. Přesto se rozhodla změnit život a splnit si sen – projít pěšky celou Ameri ku. Postavila se nemoci, poušti, omrzlinám, medvědům i pumám, které potkávala, když putovala sama divočinou. Pacifická hřebenovka ji tvrdě zkoušela. Naučila ji ale nevzdávat se.",2022
zahraniční,cestopis,cestování po světě,Cheryl Strayed,Divočina,"Pozoruhodně upřímný autobiografický příběh ženy, která se po traumatických událostech rozhodne vyrazit na 1 770 kilometrů dlouhou pěší pouť.\nV šestadvaceti letech si Cheryl Strayedová, po smrti své matky a krachu svého manželství, myslela, že přišla o vše. Měla pocit, že již nemá co ztratit a učinila nejimpulzivnější rozhodnutí svého života: odhodlala se sama ujít vysokohorskou trasu Pacifik Crest Trail od Mohavské pouště přes celou Kalifornii a Oregon až do státu Washington. \nHrdinka, bez jakýchkoli znalostí o přežití v divoké přírodě, se nevyhne střetnutí s chřestýši a medvědy, překonává úmorná vedra či rekordní sníh. Napínavé vyprávění okořeněné humorem živě zachycuje strach i radost mladé ženy tvrdě si razící cestu k cíli navzdory mizivé šanci na úspěch. Pouť ji téměř dožene k šílenství.",2013
zahraniční,cestopis,cestování po světě,Peter Popluhár,Kde všude jsem (ne)zemřel,"Série autobiografických tragikomických povídek cynického hypochondra Petra Popluhára, který se na svých cestách po Africe, Asii a Americe dostává do katastrofálních situací, potkává nepříjemné lidi a bojuje s nejrůznějšími pohromami, včetně extrémních střevních infekcí a těžké mal árie. Přestože se několikrát loučí se životem, příběhy nepostrádají nadhled a humor. Však ho to přejde, až tam jednou opravdu zemře! Peter Popluhár je slovensko-maďarský internetový bavič (v podstatě youtuber, ale nerad to přiznává před dospělými), cestovatel a neuvěřitelný smolař. Vystudoval finance na Masarykově univerzitě v Brně, což bylo na nic, protože hned po promoci se začal naplno věnovat natáčení mediálních a cestovatelských videí. Jeho projekty, které se vyznačují jemně nekorektním humorem, dosáhly od roku 2007 milionů zhlédnutí a získaly si tisíce fanoušků nejen na Slovensku, ale i v zahraničí. V současné době pracuje na anglickém kanálu YouTube PPPeter a jeho slovenském ekvivalentu PPPíter.",2024
zahraniční,cestopis,cestování po světě,Edward Michael Grylls,Vzhůru - Pozoruhodná cesta k vrcholu Mount Everestu,"Bear Grylls jako nejmladší Brit v dějinách popisuje výstup na nejvyšší horu světa Mount Everest.\nAutor mj. poutavě líčí dlouhé období pobytu v základním táboře pod Mount Everestem, kdy čekali na lepší počasí aby mohli podniknout další cesty do výškových táborů, a posléze na vrchol. Poutavým způsobem líčí atmosféru vysokohorského prostředí, popisuje překrásné přírodní scenérie, charakterizuje rázovité osobnosti svých přátel a dalších horolezců, stejně jako fyzické i psychické utrpení. Ve svých 23 letech se Bear Grylls stal nejmladším Britem, který vystoupil na vrchol této nejvyšší hory světa.",2011
zahraniční,cestopis,cestování po světě,Jon Krakauer,Útěk do divočiny,"Ihned poté, co Christopher McCandless dostudoval vysokou školu, věnoval všechny své peníze na dobročinné účely, sbalil si věci a začal se toulat po Americe. Když v dubnu 1992 dorazil na Aljašku, opustil své auto, spálil hotovost, která mu ještě zbývala, a bez mapy a dalších pomůcek se vydal do divočiny – žít po vzoru Londona, Tolstého nebo Thoreaua. O čtyři měsíce později našli v rozbitém odstaveném autobuse jeho vychrtlé mrtvé tělo. Jeho příběh hluboce zaujal novináře, spisovatele, horolezce a dobrodruha Jona Krakauera, který mapuje celé McCandlessovo putování, dává slovo lidem, s nimiž se mladík setkal, cituje jeho deník, dopisy či podtrhaná místa v knihách. Hledá mladíkovy motivy i důvody jeho selhání. Útěk do divočiny není pouhou rekonstrukcí možných událostí. Je napínavým příběhem, který dokládá autorovo dokonalé vcítění – rozpravou o lidské touze po riziku, volnosti a čistém životě v souladu s přírodou.",1999
čeští,povídky,životní moudrost,Karel Čapek,Povídky z jedné kapsy,"Sborník detektivních povídek z pera Karla Čapka patří ke skvostům české moderní prózy a právem náleží do zlatého fondu české literatury. Příběhy s kriminální zápletkou autor povýšil na studie člověčenství, které dokáží vždy překvapit a zaujmout.",2000
čeští,povídky,životní moudrost,Karel Čapek,Povídky z druhé kapsy,"Povídky z druhé kapsy napsal Karel Čapek v roce 1929 inspirován denními zprávami. V těchto detektivně laděných prózách se autor projevil jako dokonalý znalec řeči příslušníků různých společenských vrstev a povolání. Mají podobné náměty jako Povídky z první kapsy: odhalování zločinů, hledání spravedlnosti a její vykonávání. Mají však daleko širší dosah než první kniha povídek. Čapek v nich zdůraznil význam vzájemných vztahů mezi lidmi a vyslovil svoji pevnou víru v člověka opravdu lidského.",2007
čeští,povídky,humor,Jaroslav Hašek,Povídky,"Duchovní otec Švejka zahájil svou spisovatelskou dráhu drobnými povídkami, črtami a humoreskami, které publikoval v časopisech. Vybrali jsme řadu, která vycházela v Humoristických listech. Autor v nich navázal na tradici lidového šibalského humoru, kterou potom dále rozvíjel a přivedl až k dokonalosti.",2009
čeští,povídky,dospívání,kolektiv autorů,Kapuce od mikiny,"Kapuce od mikiny je sbírka povídek určených především pro náctileté. Texty povídek upozorňují na palčivá témata jako je jinakost, šikana, život s handicapem, závislosti, poruchy příjmu potravy, materialismus či předsudky. Dotýkají se také otázek hodnot jako je čestnost, vnitřní svoboda, zodpovědnost, empatie, solidarita, pokora či laskavost",2022
čeští,poezie,historie,Karel Havlíček Borovský,Epigramy,"Epigramy vznikly během pobytu v Moskvě (1842-1845), kde Havlíček pracoval jako vychovatel v rodině profesora Pogodina.
Autor v díle satiricky kritizuje dobové společenské poměry. Komentuje nejrůznější pokrytecké postoje a zažité konvence, otevřeně poukazuje na rozpory mezi hlásanými „pravdami“ a skutečností.",1845
čeští,poezie,říše fantazie,Petr Nikl,Záhádky,"Komplexní umělecké dílo, které malé i větší čtenáře zavádí do světa hravé fantazie. Tentokrát jde Petr Nikl ještě o kousek dál – čtenář si bude moci sám skládat obrázky zvířat a fantaskních tvorů z jednotlivých rozstříhaných listů (hlavy, těla a nohou) a k tomu dotvářet texty.",2007
