country,genre,topic,author,name,description,year
čeští,humorná próza,dětský svět,Vojtěch Steklač,Boříkovy lapálie - série,"Čtyři správní kluci z Holešovic Čenda, Aleš, Mirek a Bořík spolu zažívají neuvěřitelně veselé i dobrodružné příhody. Často se taky potýkají s nepřízní rodičů a třídní učitelky. Na rozdíl od třídního šprta Bohouška, který je mazánkem dospělých..",od 1970
čeští,humorná próza,dětský svět,Vojtěch Steklač,Pekelná třída,"Pekelná třída - to je parta, se kterou se seznámítei i ve třech knížkách boříkovských lapálií. Dozvíte se od ní, jak vnímají září, jak si celý školní rok zpestřují nejrůznějšími vylomeninami, co všechno je láká ve Stromovce, jak se potýkají se Zátoráky, jak si udělali mejdan, jak se vypořádávají se šplhounem Bohouškem, jak doma válčí s rodiči. Není divu, že jejich nebohá paní třídní učitelka, něžně přezdívaná Drábinka, se často chytá za hlavu a volá: ""Tahle třída, to je peklo!""",1978
čeští,humorná próza,dětský svět,Karel Poláček,Bylo nás pět,"Půvabná vyprávění o dobrodružstvích pěti nezbedných chlapců z malého českého městečka, psaná formou dětského deníku kupeckého synka Petra Bajzy.\nKlukovskýma očima viděný rok na maloměstě připomíná všechny sezónní dospělé i dětské zábavy, životní styl i hierarchii obyvatel ma lého města za první republiky.",1943
zahraniční,humorná próza,dětský svět,Jean-Jacques Sempé; René Goscinny,Mikulášovy patálie,"Mikuláš je malý nezbedný kluk s partou kamarádů, kupou bláznivých nápadů a úžasným dětským pohledem na svět. „Když jsem přišel domů, maminka mi vynadala, že jsem přišel pozdě na večeři. Když jsou takoví, tak tedy bez milosti: Zítra uteču z domova. Tatínek s maminkou se budou hrozně trápit a já se vrátím až za spoustu let a budu strašlivě bohatý a budu mít auto a letadlo!""",1964
zahraniční,humorná próza,dětský svět,Leo Calvin Rosten,Pan Kaplan má třídu rád,"Humoristický román odehrávající se v předválečném New Yorku, dílo, jehož humor spočívá v jazyku. Hrdinou knihy je evropský přistěhovalec, lidový mudrc pan Kaplan, který se, pokud jde o anglický originál, učí v New Yorku angličtině či spíše američtině, pokud jde o český překlad, učí se v témž prostředí češtině. Jde o knihu pro milovníky slov, slovních hříček a jazykových kouzel.",1937
zahraniční,humorná próza,dětský svět,Jeff Kinney,Deník malého poseroutky,"Když je vám tak jedenáct, může to být fakt opruz. A nikdo to neví líp než Greg Heffley, protože se najednou ocitl na víceletém gymplu, kde malí poseroutkové, jako je on, narážejí každý den na chodbách do kluků, kteří jsou větší, silnější a holit by se mohli dvakrát denně. Deník mal ého poseroutky není jen tak obyčejný deníček. Greg tenhle sešit dostal od mámy. A to přesto, že deníky jsou přece jenom pro holky! Takže si nemyslete, že to bude nějaké „milý deníčku“ tohle a „milý deníčku“ támhleto. Navíc tohle vlastně není deník, to jsou ZÁPISKY. Greg si prostě zapisuje a čmárá obrázky ke všemu, co se kolem něj děje. Píše o svém otravném starším bráchovi, o potrhlém kamarádu Rowleym, o každodenním boji o přežití ve škole, o jednom fakt děsivém domě hrůzy, o kreslení komiksů pro školní časopis a taky o Sejru... Jeff Kinney, autor a ilustrátor v jedné osobě, vytvořil hrdinu, který sice vypadá trochu neobvykle, ale na druhou stranu je to vlastně úplně normální puberťák.",2007
čeští,komiks,dobrodružství,Jaroslav Foglar,Stínadelská trilogie,"Souborné vydání komiksové Stínadelské trilogie obsahuje Záhadu hlavolamu, Stínadla se bouří a Tajemství Velkého Vonta. 
Vydejte se s partou Rychlých šípů na pořádnou dávku dobrodružství.",2023
čeští,komiks,dobrodružství,Jaroslav Foglar,Rychlé šípy,"V temných Stínadlech se cosi dalo do pohybu! Klub Rychlých šípů – Mirek Dušín, Jarka Metelka, Jindra Hojer, Červenáček a Rychlonožka – u toho nesmí chybět! Když chlapci poznají příběh zámečnického učně Jana Tleskače, podniknou nebezpečnou výpravu na nepřátelské území, kde je ukryt kovový hlavolam ježek v kleci. Rychlé šípy to však nebudou mít jednoduché. Stínadlům totiž vládne drsná parta Vontů...",2019
čeští,komiks,sport,Jan Novák,"Zátopek... když nemůžeš, tak přidej!","„Je to hranice bolesti a utrpení, která dělí chlapce od mužů,“ říkal Emil Zátopek. Právě posouvání mezí možností vlastního těla z něj udělalo fenomenálního běžce a jednoho z nejslavnějších sportovců historie. Když na olympijských hrách v Londýně v roce 1948 vyhrál běh na deset kilometrů a na pětikilometrové trati skončil druhý, nepovažoval to za velký úspěch. Z následující olympiády v Helsinkách přivezl tři zlaté medaile a stal se legendou, ale připsal si i důležitější vítězství – postavil se proti režimu za svého svěřence Stanislava Jungwirtha a prosadil, aby vůbec mohl na olympiádu odcestovat. ",2016
zahraniční,komiks,říše fantazie,Jeff Smith,Kůstek 1: Útěk z Kůstkova,"Mix Pána prstenů a animovaných filmů od Pixaru – tak by se dal popsat legendární fantasy epos Kůstek. Zavede vás do světa, který je plný prapodivných bytostí – věčně hladových krysáků, bojových včel, obřích rudých draků (s doutníkem) a agresivních babiček. Do světa krásného i nebezpečného. Příběh začíná úprkem tří podivných bytostí z rodného města, pokračuje závodem krav a končí bojem o osud světa s tajemným Pánem kobylek a jeho hordami. Je tu všechno, co má klasické fantasy mít (možná až na ten závod krav), jen ti hrdinové jsou na klasické fantasy tak trochu... zvláštní. Kůstek si rychle získal kultovní věhlas, veškerá možná ocenění a post jednoho z nejzásadnějších světových komiksů. Není divu, nabízí rozmáchlý příběh, ve kterém se mísí humor s emocemi, napětím a hororem a jedno plynule přechází v druhé. Příběh, který osloví absolutně každého. \n\n Toto je první díl z celé série.",2010
zahraniční,komiks,dobrodružství,Hergé,Tintinova dobrodružství,"Série komixů o belgickém reportérovi Tintinovi, který společně se svým věrným psem zažívá dobrodružství a vyšetřuje různé záhady po celém světě. /n Humorně pojaté příběhy doplňují propracované kresby.",od 1930
zahraniční,komiks,dobrodružství,Dan Johnson,Robinson Crusoe," Devatenáctiletý Robinson Crusoe není spokojen se svým klidným, ale nudným životem v Anglii. Tak rád by se plavil po moři a poznával svět. Jeho touha po dobrodružství ho přiměje bez rozloučení s rodiči opustit rodnou zemi a vydat se do cizích krajů. Během následujících pěti let poznává mnoho míst a lidí, ale především sám sebe. Zažije několik nebezpečných situací na moři i na pevnině, a tak si začíná pohrávat s myšlenkou, že se usadí. Ale jeho dobrodružná povaha ho ještě jednou přiměje nasednout na loď. Tentokrát má však ztroskotání lodi katastrofální následky a Robinson se jako jediný z posádky zachrání na zdánlivě opuštěném ostrově. Je možné, aby v takové situaci člověk sám přežil? Podaří se mu ostrov opustit, nebo na něm bude muset zůstat?",2010
zahraniční,komiks,technika,Edward Ross,Paříme - Komiksová historie videoher,"Od chvíle, kdy poprvé spustil bratrovo zaprášené atari, se komiksový kreslíř Edward Ross zbláznil do videoher. Po letech si začal klást otázky: Čím jsou hry tak výjimečné? Proč je hrajeme? A jak hry ovlivňují náš svět? V publikaci vhodné pro malé i velké zájemce nás provází časem od průkopnických technických vynálezů ze čtyřicátých let až po moderní éru blockbusterových hitů a skvostů nezávislé scény. Fanoušci a fanynky se mohou těšit, že na stránkách spatří legendární hry jako Minecraft, Super Mario, Doom, Last of Us, God of War, Legend of Zelda, Grand Theft Auto, Tomb Raider nebo Fallout. \n\nCo nás hry jako Dungeons & Dragons nebo Bioshock učí o svobodné vůli a osobní odpovědnosti? Jak herní designéři vytvářejí krajiny, v nichž se chceme ztratit? Proč a jak se ovladače stávají prodloužením našich těl? Jak se proměnilo zobrazení žen či ras ve videohrách? A ve které zemi způsobila obliba arkádových automatů nedostatek drobných?",2024
zahraniční,komiks,dobrodružství,"Charles Dixon, Sean Deming",Hobit aneb Cesta tam a zase zpátky,"Hobit je příběh Bilba Pytlíka, klidného a spokojeného hobita, kterému se celý život obrátí vzhůru nohama, když se připojí k čaroději Gandalfovi a třinácti trpaslíkům na výpravě za ukradeným pokladem. Je to cesta plná nebezpečí - a na konci musí Bilbo samojediný čelit strážci tohoto pokladu, nejobávanějšímu draku v celé Středozemi...",2007
zahraniční,fantasy,nadpřirozno,Cassandra Clare,Nástroje smrti - Město z kostí,"Když se patnáctiletá Clary Frayová vydá do newyorského klubu Pandemonium, vůbec netuší, že se stane svědkyní vraždy, kterou navíc spáchají tři teenageři se zvláštním tetováním na těle a podivnými zbraněmi v rukou. Mrtvé tělo pak jednoduše zmizí. Nejde jen tak zavolat policii, když jsou vrahové pro všechny ostatní neviditelní a na místě činu nezbyla ani kapka krve, která by napověděla, že tu zemřel člověk. A byl to vůbec člověk? Zde se Clary poprvé setká s Lovci stínů, bojovníky, kteří mají chránit svět před démony. Během čtyřiadvaceti hodin je Clary vtažena do jejich světa, její matka totiž zmizí a na samotnou Clary zaútočí démon. Proč by se ale démoni zajímali o obyčejné lidi, jako je Clary a její matka? A jak je možné, že má Clary najednou „vnitřní zrak“? To by rádi věděli i Lovci stínů… Zábavné, odvážné a neotřelé fantasy od Cassandry Clareové slibuje svým čtenářům strhující čtení, s nímž nebudou chtít přestat. \n\n Toto je první díl z celé série.",2007
zahraniční,knihy pro mládež,dospívání,Sue Townsend,Tajný deník Adriana Molea,"První z oblíbené série deníků Adriana Molea zastihuje hlavního hrdinu ve věku třinácti a půl roku. Je to pro něj nelehká doba, puberta s ním cloumá, svět je plný hlupáků a zabedněnců, kteří pro jeho umělecké vzlety nemají špetku pochopení. On je však pevně rozhodnutý statečně nést těžký úděl intelektuála.\n\nA jako by neměl dost starostí sám se sebou, doma vrcholí rodinná krize, matka odchází a Adrian zůstává s otcem, nepraktickým smolařem, navíc právě propuštěným z práce. A do toho všeho se ještě Adrian smrtelně vážně zamiluje do Pandory. Uprostřed osobních trablů a zmatků však hrdina dokáže svérázným klukovským pohledem sledovat a s neodolatelným anglickým humorem komentovat vážné i nevážné problémy, které hýbou britskou společností.",1988
zahraniční,knihy pro mládež,dospívání,Markus Zusak,Zlodějka knih,"Příběh se odehrává v nacistickém Německu a líčí dospívání mladé dívky Liesel, která začíná nový život v pěstounské péči poté, co ji opustila matka. Příběh vypráví o Lieselině vztahu s pěstouny, s ostatními obyvateli města i s mladým židovským mužem, kterého se svou nově nalezenou rodinou ukrývá ve sklepě svého domu.",2005
zahraniční,knihy pro mládež,život,Christiane F.,My děti ze stanice ZOO,"Osud Christiane F. znají miliony čtenářů po celém světě. Vyrůstali s drásavou výpovědí třináctileté německé narkomanky o pekle závislosti na heroinu a prostituci. Kniha My děti ze stanice ZOO a stejnojmenný film z ní udělaly celebritu a změnily zásadně její život. Po pětatřiceti letec h se Christiane Felscherinow nechala přesvědčit novinářkou Sonjou Vukovic, aby vyprávěla, co bylo potom. Procházíme spolu s Christiane jejím bojem se závislostí na drogách, pobytem ve vězení, ale také setkáními s legendami amerického rocku a evropské literatury, šťastnými roky v Řecku a největším darem – narozením syna Phillipa.",2014
zahraniční,knihy pro mládež,nadpřirozeno,Lisa Jane Smith,Upíří deníky,"Tato série sleduje životy upírů a jejich interakce s lidmi v moderním světě. Hlavní postavy, jako je Elena Gilbert a Stefan Salvatore, se potýkají s láskou, zradou a nebezpečím, které přichází s jejich nadpřirozenými schopnostmi. Příběh je plný napětí, romantiky a dramatických zvratů. Čtenáři se ponoří do fascinujícího světa, kde se mísí realita s nadpřirozenem.",od 1991
zahraniční,knihy pro mládež,nadpřirozeno,Stephenie Meyer,Stmívání,"""Stmívání"" je fenoménem, který oslnil čtenáře po celém světě. Tato kultovní knižní série od Stephenie Meyerové nás vtáhne do světa naplněného romantikou, nadpřirozenem a nebezpečnými tajemstvími. První díl série nese název ""Stmívání"" a zavede nás do městečka Forks, kde se hlavní hrdinka Bella Swanová zamiluje do tajuplného Edwarda Cullena. /n Edward a jeho rodina však ukrývají temné tajemství – jsou upíři. Přestože se snaží Bella i Edward překonat své odlišné podstaty, jejich láska je neustále prověřována vnějšími hrozbami a vnitřními konflikty. Čtenáři se mohou těšit na napínavý milostný příběh, který zahrnuje nadpřirozené bytosti, nebezpečné střety a nepřekonatelné překážky.",od 2005
zahraniční,knihy pro mládež,dospívání,Grace Dent,Klukům vstup zakázán,"Veronika a její dvě kamarádky se chtějí vydat na rockový festival, ale rodiče je nepustí, protože o ně mají strach. A tak si tři kamarádky na pozemk u školy uspořádají festival vlastní, s účastí školních kapel včetně skejťáka Jimiho, do kterého je Veronika zamilovaná. A možná se objeví i další hvězdy.",2003
zahraniční,knihy pro mládež,dospívání,Jostein Gaarder,Dívka s pomeranči,"Hrdinou této knihy je Georg, kterému zemřel otec, když byl hodně malý. A teď se najednou najde jeho dopis adresovaný synovi. Napsal ho krátce před smrtí, protože věděl, že mu chtěl předat některé své myšlenky a poselství, kterým by tehdy malý Georg nerozuměl. Tento emočně nabitý příb ěh vypráví o nemoci a marném boji, ale také o naději. ",2003
zahraniční,knihy pro mládež,zvířata,Rudyard Kipling,Kniha džunglí,"Lidské mládě. Odchovanec vlků, mrštný jako had a rychlý jako panter. Stane se lovcem lovců. Krásný dobrodružný příběh Mauglího, chlapce který vyroste mezi zvířaty v divoké džungli, splyne s ní a stane se její součástí. Dojemný vztah mezi člověkem a zvířaty, zvláště vlky.",1968
zahraniční,knihy pro mládež,zvířata,Jack London,Volání divočiny,"Známý a proslavený příběh severského psa Bucka. S obdivhodnou věrojatností zobrazuje autor všechny prožitky Buckova přizpůsobování se přechodu z pohodlí a slunečného blahobytu na panském sídle do drsné a mrazivé skutečnosti Severu, kde se z něho stává chytrý, smělý a bojovný hrdina.",1957
zahraniční,knihy pro mládež,zvířata,Jack London,Bílý tesák,"Ve vyprávění o osudech samotářského míšence psa a vlka vyjádřil autor své nejcennější myšlenky – víru v sílu života, přesvědčení o tom, že štěstí je neoddělitelné od věrnosti, s jakou dokážeme sloužit dobrým cílům.",1995
zahraniční,knihy pro mládež,,Mark Twain,Dobrodružství Toma Sawyera,"Román Dobrodružství Toma Sawyera, poprvé vydaný už v roce 1876, v dětství s gustem četli naši rodiče i rodiče našich rodičů. Spolu s Dobrodružstvím Huckleberryho Finna se stal na dlouhou dobu nejoblíbenější klukovskou četbou. Nyní vychází v novém českém překladu Jany Mertinové, který přibližuje originál současnosti. Autorův humor i poutavý způsob vyprávění se tak stává srozumitelnější pro dnešní čtenáře.\nS uličníkem Tomem a jeho kamarádem Huckem budou dnešní kluci znovu prožívat dobrodružný útěk z domova, pirátský život na pustím ostrově i hledání pokladu ve strašidelném domě. Stejně jako mnoho generací před nimi budou číst o tom, jak se oba kamarádi zastali neprávem obviněného Mouly Pottera a ohromili poklidné městečko odhalením skutečného vraha.\n13-121-KMČ-89",1989
zahraniční,knihy pro mládež,,Daniel Defoe,u,"Těžko bychom hledali čtenáře, který by neznal už od dětských let – většinou ovšem v úpravách či převyprávěních – jádro tohoto klasického díla anglické prózy. A kolik nejrůznějších robinsonád se inspirovalo během staletí Defoeovým barvitým líčením, které mu získalo populari tu už r. 1719. Svědčí to nesporně o životném jádru „zvláštních podivných dobrodružství“ námořníka z Yorku, který je tipickým představitelem své doby, ale nese v sobě i pevné optimistické přesvědčení přesahující jeho éru: o lidské zvídavosti, nezdolnosti, odvaze. Nové vydání předkládá čtenáři však nejen známý nezkrácený text prvního dílu o Robinsonových cestách a zážitcích, ale i méně známé pokračování o „dalších dobrodružstvích“ tohoto Defoeova hrdiny. Sledujeme tedy nejprve osud trosečníka, který na opuštěném ostrově v Atlantském oceánu prožije téměř třicet let a svou vynalézavostí a dovedností svých rukou uhájí jak holou existenci, tak si dokáže zpříjemnit prostředí kolem sebe a obstojí ve zkoušce „rozumem obdařené bytosti“ – i odvážně čelí divochům, kteří na jeho ostrov zajíždějí ke kanibalským hodům. Návratem z ostrova však Robinsonovy pohnuté osudy nekončí. Neklidná krev ho žene na nové cesty, do nového podnikání. Spolu se svým věrným domorodým sluhou Pátkem podniká nejprve cestu po západní Evropě a pak se znovu vydá na moře, do Západní Indie. Zavítá na svůj ostrov či kolonii, až nakonec svá putování uzavře návratem po souši přes Čínu, Mongolsko, Sibiř, Rusko. Do vlasti se vrací po mnoha letech jako stařec. Díky své podnikavosti a neohroženosti zbohatl a s uspokojením přehlíží své úspěchy. Robinsonovy cesty, postřehy i úvahy představují neobyčejně zajímavou charakteristiku doby, její podnikavosti i etiky. Jako jedinečný dokument i svébytné umělecké dílo zaujme i po více než dvě stě padesáti letech od svého vzniku, a dnešního čtenáře navíc ještě pro krásné nové ilustrace Adolfa Borna.",1975
zahraniční,knihy pro mládež,,Jules Verne,Cesta kolem světa za 80 dní,Slavný příběh Philease Fogga a sluhy Passepartouta a jejich cesta kolem světa.,1997
zahraniční,knihy pro mládež,,Jules Verne,Dva roky prázdnin,"Jeden z nejúspěšnějších románů Vernových, který stále poutá mladé čtenáře toužící po dobrodružství. Vypráví příhody patnácti chlapců-školáků zanesených bouří na pustý ostrov a bojujících na něm o svůj život.",1973
zahraniční,knihy pro mládež,,Raquel J. Palacio,Neobyčejný kluk,"Jmenuju se August a vypadám trochu zvláštně… ale jinak jsem stejný jako vy! Auggie není obyčejný desetiletý kluk, i když dělá docela obyčejné věci – jako všechny děti v jeho věku. Má totiž skutečně neobyčejnou tvář... Narodil se s deformovaným obličejem. Když má nastoupit do páté třídy Beecherovy školy, vzbuzuje to v něm i v jeho rodičích obavy, naději a otázky, jak ho jeho noví spolužáci přijmou. Podaří se Auggiemi přesvědčit své spolužáky o tom, že je navzdory svému vzhledu stejný jako oni? \nOriginální a inspirující román si od svého uvedení na trh v roce 2012 přečetlo přes více než 6 milionů čtenářů. Na motivy knihy natočil režisér Stephen Chbosky film s Jacobem Tremblayem, Julií Robertsovou a Owenem Wilsonem v hlavních rolích.",2018
zahraniční,knihy pro mládež,,Rick Riordan,Percy Jackson: Zloděj blesku,"Jmenuji se Percy Jackson!\nDoteď jsem si myslel, že jsem obyčejný kluk, kterého čeká vyhazov ze školy. Zjistil jsem ale, že můj otec je bůh z Olympu. Moje učitelka se proměnila v krvavou příšeru a kamarád je Satyr. Všichni na mě mají spadeno a podezřívají mě z krádeže blesku, zbraně mocn ého boha Dia. Musím dokázat svou nevinu, najít ukradený blesk a s ním i zloděje...",2022
zahraniční,detektivka,,Thomas Brezina,Čarodějova věž,"Parta detektivů musí tentokrát rozlousknout zapeklitý případ. Ve vesničce, kde lišky dávají dobrou noc, se začne zjevovat čaroděj, který je už pět set let mrtvý. Je to duch, nebo se jedná jen o nějaké laciné triky? Navíc se zdá, jako by všichni obyvatelé Limbachu měli co skrývat. Podař í se Čtyřce rozplést labyrint lží a úskoků?",2009
zahraniční,detektivka,,Thomas Brezina,Klub záhad,Bez popisu.,
zahraniční,detektivka,,Arthur Conan Doyle,Dobrodružství Sherlocka Holmese,"Tato kniha přináší první nadílku Doylových povídek o slavném detektivovi. Původně vycházely v letech 1891–1892 a my je vydali o 105 let (nebo 26) později do doby zcela jiné, odlišné tempem, morálkou i typem zločinů. Byly však ty staré zlaté časy skutečně tak zlaté? Holmes a Watson o tom vědí své. Pro nás však kouzlo té doby zůstává nezměněno. Nuže, vzhůru do zamlžených ulic, na kvetoucí vřesoviště.",1982
zahraniční,detektivka,,Robin Stevens,Záhada zamčeného kupé,"Dívčí detektivní klub řeší třetí případ. Detektivka pro mladé dámy ve stylu Agathy Christie!\n\nDaisy Wellsová a Hazel Wongová cestují na prázdniny slavným Orient Expresem. Od chvíle, kdy dívky nastoupily, je jasné, že každý cestující v tomto luxusním vlaku něco skrývá. Pak se z jedno ho kupé ozve výkřik a bohatá dědička je nalezena mrtvá. Po vrahovi nezůstane ani stopa – jako by se vypařil. Daisy a Hazel budou řešit svoji první záhadu zamčeného pokoje. A zároveň čelit několika dalším detektivům, kteří chtějí případ rozlousknout dřív než ony.",2022
čeští,detektivka,,Daniela Krolupperová,Zločin na Starém Městě pražském,"Dobrodružný detektivní román odehrávající se za života významného českého malíře Jakuba Schikanedera. K pátrání po původci smrti mladé dívky, která zemřela v důsledku pádu z pavlače, přispěje sám Jakub, jenž se stal v dětských letech svědkem této tragédie. Jakubovi se děsivá ud álost vryla hluboko do paměti, a když po mnoha letech potká osobu, která u ní také byla přítomna, vybaví se mu další vzpomínky. Co se vlastně tehdy stalo? Samotný děj příběhu nezachycuje jen složité pátrání, ale i život dodnes oblíbeného a uznávaného Jakuba Schikanedera (1855-1924), jehož známým obrazem je právě Vražda v domě.",2014
čeští,detektivka,,Petra Soukupová,Kdo zabil Snížka?,"Když si Martina přála psa, netušila, že se Snížkem budou samé potíže. Z malého bílého štěněte vyrostl pes, kterého skoro nikdo ve vesnici nemá rád. Dokonce i její máma se ho bojí. A tak když Martina jednoho dne najde Snížka mrtvého, hned ji napadne, že nezemřel náhodou.\nOpravdu Sníž ka někdo zabil?\nMartina se spolu s kamarády Frantou, Kájou a Viktorem pustí do vyšetřování Snížkovy smrti a jejich dobrodružné pátrání přinese nečekaná odhalení.\nPo knížce Bertík a čmuchadlo přichází úspěšná autorka knih pro dospělé Petra Soukupová s dalším neobyčejným příběhem pro děti, tentokrát s detektivní zápletkou.",2017
čeští,detektivka,,Marek Toman,Inspektor Mol a případ ztraceného rukopisu,"Knihovna jako místo činu, čtenáři jako podezřelí a jeden detektiv, který si na ně došlápne…\nTomáš je kluk ze sídliště, který netuší, co se sebou. V jeho životě se ale objeví detektiv Mol – drsňák s ostřížím zrakem a smyslem pro spravedlnost. Když v městské knihovně záhadně zm izí rukopis literární hvězdy Gréty Grande, vyráží Mol do akce. V této brilantní parodii na noirovou detektivku určené -náctiletým i dospělým čtenářům se Marku Tomanovi podařilo propojit humor, nečekané detektivní zvraty a lásku ke knihám. Povede se Molovi vyřešit jeho největší případ? A hlavně – dokáže zjistit, kým vlastně je?",2025
zahraniční,,zvířata,George Orwell,Farma zvířat,"Pozoruhodná bajka začíná vzpourou zvířat, která vyženou majitele farmy a začnou si vládnout sama. Zprvu ušlechtilé, idealistické myšlenky o rovnosti, svobodě a blahobytu záhy berou za své a jejich místo postupně zaujme propaganda, nesvoboda a totalitní diktatura.",1991
