country,genre,topic,author,name,description,year
čeští,,zvířata,Iva Procházková,Myši patří do nebe,"Fantaskní příběh s nečekanou a nápaditou pointou, napsaný jako humorné vyprávění o dvou kamarádech. Velké přátelství myšky Šupito a lišáka Bělobřicha je dramaticky přerušeno, ale oba přátelé se znovu setkají v přívětivé zemi na hranici mezi životem a smrtí, kde prožívají podivu hodná dobrodružství. Motiv smrti je podán tak, že se ho malý čtenář nezalekne, a přijme ho jako součást příběhu. Autorka chtěla svým barvitým vyprávěním z přírody setřást bázeň ze smrti, která děti mnohdy obestírá, a naznačit, že nějaký svět existuje i dál. Tohoto tématu se již před časem znamenitě zhostila Astrid Lindgrenová, teď se to na malém příběhu stejně dobře podařilo jedné z nejlepších současných autorek pro děti a mládež Ivě Procházkové. Vznikla odvážná knížka, která je důkazem, že moderní česká literatura pro děti stále patří k evropské špičce.",2006
čeští,,zvířata,Ota Pavel,Smrt krásných srnců,"Povídková kniha, ve které Ota Pavel vzpomíná na šťastné dětství před válkou i neradostná válečná léta. Ústřední postavou je jeho otec Leo Popper, obchodní zástupce firmy Elektrolux.",2000
čeští,,zvířata,Ota Pavel,Jak jsem potkal ryby,"V svazku nazvaném Jak jsem potkal ryby (1974) Ota Pavel vědomě navázal na úspěšnou sbírku Smrt krásných srnců (1972). Opustil definitivně svět sportovců a sportu a vrátil se opět do krajin svého dětství a mládí – na Buštěhrad, na Berounku, k řekám, potokům a mořím.\n\nHrdiny jeho pov ídek jsou opět členové jeho rodiny v čele s „povedeným tatínkem“, bratry Jirkou a Hugem, ale prim tu hraje příroda, ryby především, a hlavně pokora a úcta k člověku. Celek mistrovského literárního díla je návratem k pramenům „vody živé“ – a čtenáři odtud mohou spolehlivě čerpat energii a sílu k životu.",2004
čeští,,zvířata,Markéta Baňková,Straka v říši entropie,"Straka v říši entropie jsou bajky pro dospělé i děti. Zvířata v nich luští záhady existence a fungování světa. Zjistíme, proč se hroch udrží na vodní hladině i proč někteří samci nepohrdnou samičkou z igelitu. Jak lišky prochází krizí středního věku a kdo všechno chce být ideálem krásy. Proč nemá smysl bojovat proti nepořádku a jak zatočit s jezevcem notorikem. Jak může notorik pád ze schodů omluvit zakřivením časoprostoru a že i myši mají určitý názor na kvantovou neurčitost. Vzrušující témata podstaty vesmíru, která jinak bývají pro laika příliš složitá, jsou v této knize podána lehce, jakoby mimochodem. Kniha humornou formou přibližuje klasické fyzikální zákony, které pochopí malé děti, ale dotýká se i náročných témat fyziky moderní doby, určené starším dětem a dospělým. Vhodná je pro rodiče, kteří čtou dětem, ale současně hledají i knihu pro sebe. Zaujme také čtenáře, které fyzika nezajímá, nebo z ní mají dokonce strach – ti najdou především grotesku, jejíž hrdinové po cestě vědy docházejí k filosofii.",2010
zahraniční,,cestování,Jonathan Swift,Gulliverovy cesty,"Utopický román anglického spisovatele 18. století, pod rouškou imaginárního cestopisu satiricky líčí poměry v Anglii, kritizuje civilizaci a relativizuje sílu lidského rozumu. \n\nRomán, jehož původní název zněl „Cesty k rozličným národům světa . . . „, je rozdělen do čtyř dílů o n estejném počtu kapitol (osm, osm, jedenáct, dvanáct), nesoucích tzv. epická záhlaví. Je mu předeslána fiktivní předmluva vydavatele Sympsona a dopis autora – kapitána Lemuela Gullivera tomuto vydavateli. Fikci pravdivosti podtrhují také mapky, portrét Gullivera a autentická 1. osoba, v níž se líčí Gulliverovy cesty na utopické ostrovy. V I. dílu „Cesta do Liliputu“ se Gulliver ocitá mezi trpaslíky, ve II. dílu „Cesta do Brobdingnagu“ mezi obry. Ve III. dílu „Cesta do Laputy, Balnibardi, Luggnaggu, Blubbdubdribu“ se představy o světě vtělují do alegorie vznášejícího se ostrova (Laputa – alegorie sféry teoretického myšlení a uzavřené aristokracie) a obrazu hospodářsky a kulturně upadajícího státu Balnibardi. V tomto dílu promlouvá Gulliver se slavnými muži minulosti a poznává Struldbrugy, nesmrtelné obyvatele ostrova Luggnaggu. Tématem IV. dílu „Cesta do země Hvajninimů“ je výměna sociálních rolí mezi koňmi a lidmi. Lidé, tzv. Jahuové, slouží v ideální říši ušlechtilým zvířatům. Gulliver prožívá nejrůznější dobrodružství a po mnohaleté cestě se vrací domů. Putování po imaginárních ostrovech a zemích je záminkou ke kritice domácích poměrů a evropské kultury. Souběžně s negativními obrazy autor rýsuje projekt ideálního zřízení.",1975
čeští,,dětský hrdina,Marie Majerová,Robinsonka,"Ve své, dnes již klasické knížce pro mládež Robinsonka líčí národní umělkyně Marie Majerová s jemným humorem a hlubokým porozuměním pro city a nálady mladé dívčí duše přerod své dospívající hrdinky Blaženy Borové. Po matčině náhlé smrti zůstává s tatínkem – taxikářem a n ovorozeným bratříčkem Péťou sama. Pro čtrnáctiletou studentku, žijící dříve jako bezstarostný zhýčkaný jedináček, nastává v bytě, který se jí proměnil v pustý ostrov, každodenní zápas s nezvyklými starostmi o domácnost. Bláža si připadá docela jako Robinson, hrdina slavného anglického románu Daniela Defoea a statečně se z říše vysněných dobrodružství probojovává ke skutečnému životu.",1984
čeští,,dětský hrdina,Stanislav Rudolf,Kopretiny pro zámeckou paní,"Prázdninová komedie o holkách krásně praštěných. Patnáctiletá Kateřina Krásná žije se svými rodiči - kastelány na hradě Krabonoši. Je otrávená pomyšlením, že stráví svoje prázdniny v neútulné pokladně hradu. její - podle jejího názoru - nudný život na Krabonoši je narušen pří chodem studenta Petra, který by měl na hradě dělat průvodce. Katka se do něj zamiluje a marně se snaží upoutat jeho pozornost a to opravdu všemi způsoby, dokonce i fingovanou krádeží vzácných korbelíků z hradní sbírky. Katka má sice průšvih, ale ten konečně přiměje Petra, aby si jí všiml.",1981
zahraniční,,dětský hrdina,Kiera Cass,Selekce,"35 dívek. 1 princ. Životní šance. To je SELEKCE!\n\nPro dívky je Selekce životní šancí. Příležitostí k útěku od života, který jim byl stanoven od narození. Být obklopena světem třpytivých šatů a drahocenných šperků. Žít v paláci a soutěžit o srdce krásného prince Maxona. Ale pro A mericu to znamená otočit se zády ke své tajné lásce Aspenovi, který je o kastu níž než ona. Nechce se jí odejít z domova a vstoupit do nelítostné soutěže o korunku.",2021
čeští,,sport,Eduard Bass,Klapzubova jedenáctka,"Dnes už klasický román Eduarda Basse z roku 1922 vypráví příběh otce Klapzuby, který ze svých jedenácti synů vychová fenomenální fotbalový tým. Základní dílo české humoristické prózy můžeme číst jako oslavu ducha fair play, houževnatosti a sportovního nadšení i jako dobově aktuáln í hříčku, lehce ironizující opojení českou kopanou a narážející na události v poválečné společnosti. Ne náhodou si kniha získala obrovskou popularitu mezi mladými i dospělými čtenáři a dočkala se již více než 30 vydání. Nyní vychází nově v grafickém provedení Zdeňka Zieglera a s poutavými barevnými ilustracemi Jiřího Gruse.",2008
čeští,,historie,Eduard Petiška,Staré řecké báje a pověsti,"Dávné řecké báje a pověsti zrodila lidová fantazie starověkých Řeků v době, kdy lidé ještě neznali ani železný pluh. Vytvořil je génius slavného národa Helénů a obstály ve zkouškách tisíciletí. Jen těžko si lze představit kulturního člověka, který by nevěděl, kdo byli Herkules nebo Prométheus, Afrodita či Europa, Kyklopové, Sirény, Múzy nebo hromovládný Zeus. Výběr z těchto bájí a pověstí zpracoval na počátku druhé poloviny minulého století spisovatel Eduard Petiška a čtenáři si knihu, napsanou velmi moderně, ale přitom s velkou úctou k tradici, oblíbili hlavně pro její poutavost a svěžest.",2005
čeští,,historie,Eduard Petiška,Staré české báje a pověsti,Bez popisu.,
čeští,,historie,Alois Jirásek,Staré pověsti české,"Knížka od samotného prvního vydání v roce 1894 patří do zlatého fondu české literatury a její znalost patří k základnímu vzdělání. Jirásek tu sebral a beletristicky zpracoval nejznámější české pověsti. Dočteme se mezi nimi např. o praotci Čechovi, Krokovi a jeho dcerách, Přemyslovi i Libušiných proroctvích nebo o staré Praze...",1992
čeští,,historie,Vendula Borůvková,1918 aneb Jak jsem dal gól přes celé Československo,"To si takhle čutáte a najednou bum! Československo! Je pondělí 28. října. Desetiletý Jenda se těší, že si po škole zahraje s kamarády fotbal. Jenže jeho tatínek, učitel Antonín Vosika, s ním má na odpoledne jiné plány. Zatraceně, zdržení před blížícím se důležitým zápasem si Jenda nemůže dovolit! A to ještě netuší, že tohle zdržení se protáhne na několik let a skončí o tisíc kilometrů dál. V roce 1918 vzniklo Československo. Stát, v němž si po dlouhých staletích opět vládli Češi společně se Slováky. Oslavy a provolávání jména prvního československého prezidenta Tomáše Garrigua Masaryka zní dodnes. Děti i mnozí dospělí se přitom sami sebe ptají — co to má všechno propána společného se mnou? Stejnou otázku si kladly tisíce lidí i před sto lety. Hlavně děti se musely podivovat. To se najednou všichni dospělí zbláznili? Takhle jásat nad nějakým starým pánem a podivným slovem republika… Jako Jenda. Ten si chce jen zakopat s kamarády, ať už mluví česky, nebo německy. Nemá však na výběr, Československo nečeká. A Jenda se musí s celou rodinou vydat na dlouhou a dalekou cestu, při níž zjistí, jak se ho celý ten blázinec týká.",2018
čeští,,historie,Markéta Pilátová,Holčička ze známky,"Říká vám něco jméno Eva Haňková? Za první republiky ji znal každý!\n\nEva byla „holčička ze známky“, kterou prezident Masaryk při návštěvě Pardubic zvedl do vzduchu a objal, a z tohoto gesta byla cítit taková radost a optimismus mladé republiky, že se dopisní známka s fotografií holč ičky a TGM prodávala v milionových nákladech a z Evy se stala svého druhu celebrita. Doba se však rychle změnila, přišla válka a komunistický převrat a v Československu se „holčičce ze známky“, nyní emancipované a univerzitně vzdělané mladé ženě, přestalo volně dýchat. Spolu se svým manželem emigrovala do USA, protože toužila po životě ve svobodě. Příběh symbolicky končí setkáním s dalším prezidentem, Václavem Havlem, opět ve svobodné zemi.\n\nAutorka přístupně přibližuje dětem české dějiny 20. století.",2025
zahraniční,,historie,Art Spiegelman,Maus,"K 25. výročí prvního vydání slavného komiksu Arta Spiegelmana Maus vychází první souborné vydání obou dvou dílů knihy v jednom vázaném svazku. Maus je děsivým - a současně hodnotně umělecky ztvárněným - zobrazením holocaustu, které oslovilo miliony čtenářů po celém světě. Místo lidí vystupují v příběhu myši a jiná zvířata - odtud název knihy. Maus je jedním z vrcholných děl moderní světové literatury, která se snaží přispět k tomu, aby lidé nezapomněli na to, co znamenal nacismus.",2012
čeští,,dospívání,Ivona Březinová,Holky na vodítku - série,Bez popisu.,
čeští,,dospívání,kolektiv autorů,Kapuce od mikiny,Bez popisu.,
zahraniční,,dospívání,Silène Edgar,14-14 Přátelství napříč staletími,"Hadrien a Adrien jsou dva třináctiletí kluci, kteří od sebe žijí jen pár kilometrů ve Francii. Mají problémy ve škole, doma a i s dívkami – jako většina kluků jejich věku. Jen jedna věc je od sebe dělí: Hadrian žije v roce 1914 a Adrien v roce 2014. Jejich osudy se záhadně propojí, když si začnou psát dopisy. Myslí si, že píšou jenom vzdálenému bratranci, a vůbec netuší, že jejich dopisy putují časem. Když si Adrien uvědomí, že Hadrien žije před sto lety, rozhodne se ho varovat – blíží se první světová válka a jeho kamarád se musí za každou cenu ukrýt",2017
zahraniční,,říše fantazie,Katherine Paterson,Most do země Terabithia,Bez popisu.,
,,,,,,
,,,,,,
,,,,,,
,,,,,,

